{
  "schema_version": "1.1",
  "ledger_id": "budget_run_bank_20260724_002",
  "run_id": "run_bank_20260724_002",
  "currency": "USD",
  "limit": "5",
  "reserved": "0",
  "settled": "0.021",
  "available": "4.979",
  "status": "within_budget",
  "transactions": [
    {
      "transaction_id": "btx_b023c1c5c169d4bf",
      "kind": "reserve",
      "operation_id": "op_e890f1e4493a65da",
      "model_invocation_id": "mi_29f99e5b4423d0b9",
      "amount": "0.03",
      "at": "2026-07-24T04:00:50Z",
      "reason": "pre-dispatch estimate"
    },
    {
      "transaction_id": "btx_19ce36dd544f1632",
      "kind": "settle",
      "operation_id": "op_e890f1e4493a65da",
      "model_invocation_id": "mi_29f99e5b4423d0b9",
      "amount": "0.021",
      "at": "2026-07-24T04:00:58Z",
      "reason": "mock invocation completed"
    },
    {
      "transaction_id": "btx_8de6ee73db8549d0",
      "kind": "release",
      "operation_id": "op_e890f1e4493a65da",
      "model_invocation_id": "mi_29f99e5b4423d0b9",
      "amount": "0.009",
      "at": "2026-07-24T04:00:59Z",
      "reason": "unused reservation"
    }
  ]
}
