{
  "schema_version": "1.1",
  "ledger_id": "budget_run_loan_20260724_002",
  "run_id": "run_loan_20260724_002",
  "currency": "USD",
  "limit": "2",
  "reserved": "0",
  "settled": "0.009",
  "available": "1.991",
  "status": "within_budget",
  "transactions": [
    {
      "transaction_id": "btx_4644fb7d769134dc",
      "kind": "reserve",
      "operation_id": "op_8c0e72d3d5e125b2",
      "model_invocation_id": "mi_b61378bccbdaf386",
      "amount": "0.012",
      "at": "2026-07-24T02:40:11Z",
      "reason": "pre-dispatch estimate"
    },
    {
      "transaction_id": "btx_7e4de85b049d1082",
      "kind": "settle",
      "operation_id": "op_8c0e72d3d5e125b2",
      "model_invocation_id": "mi_b61378bccbdaf386",
      "amount": "0.009",
      "at": "2026-07-24T02:40:19Z",
      "reason": "mock invocation completed"
    },
    {
      "transaction_id": "btx_c97954bbdf4f72a4",
      "kind": "release",
      "operation_id": "op_8c0e72d3d5e125b2",
      "model_invocation_id": "mi_b61378bccbdaf386",
      "amount": "0.003",
      "at": "2026-07-24T02:40:20Z",
      "reason": "unused reservation"
    }
  ]
}
